{"code":[],"concepts":[],"operation_id":"synthetic-compile","papers":[{"associations":[{"association_id":"sva-640c536eae83f6bd25c87a006b2b7579ffa3f906094557e593d28bce0c0ec869","extraction":{"path":".raw/derived/markdown-source/3e1b92248c176af4ffe098a2c392ea402a9c314cb186b6309ffde50304c96826/99c12d0387220e776a811a0953aec963fc62d0c04b7cb2490006b6fc8192bab2.json","sha256":"99c12d0387220e776a811a0953aec963fc62d0c04b7cb2490006b6fc8192bab2","size_bytes":822},"observation":{"light_paper_id":"sha256:aaaaaaaaaaaaaaaaaaaaaaaaaaaaaaaaaaaaaaaaaaaaaaaaaaaaaaaaaaaaaaaa","markdown":{"sha256":"3e1b92248c176af4ffe098a2c392ea402a9c314cb186b6309ffde50304c96826","size_bytes":154},"original_pdf_sha256":null,"pages":[{"anchor":"page-1","page":1,"text_end":87,"text_sha256":"8ef5719728ce08b61f2b1fcd9265d47828db971e949555e9c57ef852b92ce92f","text_start":56},{"anchor":"page-2","page":2,"text_end":136,"text_sha256":"06a04ded2f04f0c3506c90940690e81bd8cecba9c3f5fbebfee6bf5a8c5b84f6","text_start":124}],"paper_id":"sha256:aaaaaaaaaaaaaaaaaaaaaaaaaaaaaaaaaaaaaaaaaaaaaaaaaaaaaaaaaaaaaaaa","schema":"video-paper-wiki.markdown-source-observation.v1","source_metadata_sha256":"bbbbbbbbbbbbbbbbbbbbbbbbbbbbbbbbbbbbbbbbbbbbbbbbbbbbbbbbbbbbbbbb","title":"Synthetic source","version":{"kind":"unknown","label":null}},"paper_id":"sha256:aaaaaaaaaaaaaaaaaaaaaaaaaaaaaaaaaaaaaaaaaaaaaaaaaaaaaaaaaaaaaaaa","raw":{"path":".raw/captured/3e1b92248c176af4ffe098a2c392ea402a9c314cb186b6309ffde50304c96826.md","sha256":"3e1b92248c176af4ffe098a2c392ea402a9c314cb186b6309ffde50304c96826","size_bytes":154},"registration":{"receipt_path":"wiki/meta/operations/000000000001-synthetic-registration.json","receipt_sha256":"22af2fab5b093f37945b7e4b9207acfb3a5a8813b3f782344f54bb7c01cb444c","source_ledger_path":".raw/derived/source-ledgers/ef0cb4399d802ffbf78a4430a73e90840d5c009250dcd5ae149e3a324337791e.json","source_ledger_sha256":"ef0cb4399d802ffbf78a4430a73e90840d5c009250dcd5ae149e3a324337791e"},"schema":"video-paper-wiki.source-version-association.v1","source_id":"src-f4e0d5a3b10deb2faa35","version":{"kind":"unknown","label":null}}],"claims":[{"assessment":"provisional","canonical_claim_text":"A synthetic exact source claim.","claim_id":"clm-2c86d42ff1e1ecab2bc3","evidence":[{"association":{"association_id":"sva-640c536eae83f6bd25c87a006b2b7579ffa3f906094557e593d28bce0c0ec869","sha256":"c5ea98ec5a5806250e55e3d333de14d1bd6affb90dd73cbcc3ae8b569725b660"},"charspan":[56,87],"excerpt_sha256":"8ef5719728ce08b61f2b1fcd9265d47828db971e949555e9c57ef852b92ce92f","kind":"markdown","page_anchor":"page-1","path":".raw/captured/3e1b92248c176af4ffe098a2c392ea402a9c314cb186b6309ffde50304c96826.md","relation":"supports","sha256":"3e1b92248c176af4ffe098a2c392ea402a9c314cb186b6309ffde50304c96826","source_id":"src-f4e0d5a3b10deb2faa35"}],"reviewed_at":null,"stable_subject_id":"paper:sha256:aaaaaaaaaaaaaaaaaaaaaaaaaaaaaaaaaaaaaaaaaaaaaaaaaaaaaaaaaaaaaaaa"}],"display_decisions":[{"actor":{"identity":"synthetic-reviewer","kind":"human"},"association":{"association_id":"sva-640c536eae83f6bd25c87a006b2b7579ffa3f906094557e593d28bce0c0ec869","sha256":"c5ea98ec5a5806250e55e3d333de14d1bd6affb90dd73cbcc3ae8b569725b660"},"choice":{"reference":"tests/source_semantics_fixture.py","source":"fixture","text":"Synthetic display selection."},"decided_at":"2026-09-09T00:00:00Z","decision_id":"svd-6c2acef518ea0b8013aea5777293d55e287e0a2437dcb9da1fc1bcfc82de88e6","paper_id":"sha256:aaaaaaaaaaaaaaaaaaaaaaaaaaaaaaaaaaaaaaaaaaaaaaaaaaaaaaaaaaaaaaaa","previous_decision_id":null,"reason":"Synthetic test selection.","schema":"video-paper-wiki.source-display-decision.v1","sequence":1}],"events":[{"actor_kind":"system","claim_id":"clm-2c86d42ff1e1ecab2bc3","claim_text_sha256":"e25fe65bce665c24cfc9b0e393bd242be5324287085aeef11b0fca8ae34b2fd3","decided_at":"2026-09-09T00:00:00Z","decided_by":"synthetic-fixture-reviewer","event_id":"ase-36a4193c1cdf15dc3457","evidence_fingerprint":"4d3b5a3e16d37d5823961f41ed7032429b54b3bc29edbc5fd3326a7cb27c5e49","evidence_profile":"mixed-v2","from_assessment":null,"previous_event_id":null,"reason":"Synthetic test event.","schema":"video-paper-wiki.assessment-event.v2","to_assessment":"provisional","transition_kind":"genesis"}],"record":{"active_extraction_path":".raw/derived/markdown-source/3e1b92248c176af4ffe098a2c392ea402a9c314cb186b6309ffde50304c96826/99c12d0387220e776a811a0953aec963fc62d0c04b7cb2490006b6fc8192bab2.json","active_extraction_sha256":"99c12d0387220e776a811a0953aec963fc62d0c04b7cb2490006b6fc8192bab2","aliases":[],"authors":["Ada Example"],"code_urls":[],"created_at":"2026-09-09T00:00:00Z","display_head":{"decision_id":"svd-6c2acef518ea0b8013aea5777293d55e287e0a2437dcb9da1fc1bcfc82de88e6","sha256":"75cae02ab3c9edae2954b68d3d8e407de6fd906c4ec784ab815100e6d70fdd20"},"paper_id":"sha256:aaaaaaaaaaaaaaaaaaaaaaaaaaaaaaaaaaaaaaaaaaaaaaaaaaaaaaaaaaaaaaaa","published_at":"2023-11-25","schema":"video-paper-wiki.paper-record.v2","section_claim_refs":[{"claim_id":"clm-2c86d42ff1e1ecab2bc3","core":true,"lifecycle":"active","section":"one_sentence_conclusion"}],"source_associations":[{"association_id":"sva-640c536eae83f6bd25c87a006b2b7579ffa3f906094557e593d28bce0c0ec869","sha256":"c5ea98ec5a5806250e55e3d333de14d1bd6affb90dd73cbcc3ae8b569725b660"}],"source_ids":["src-f4e0d5a3b10deb2faa35"],"taxonomy":[],"title":"Synthetic source","title_zh":"合成来源示例","updated_at":"2026-09-09T00:00:00Z"}}],"schema":"video-paper-wiki.compile-input.v2"}
